{"action_class": "review", "asset_id": "042983E8-9A90-4A58-887E-5F12AE1DCE7D-97294", "created_at": "2026-08-25T14:45:00", "data_origin": "observed", "evidence_ids": ["ev_0123456789abcdef0123"], "knowledge_chunk_ids": [], "rationale": "Units unconfirmed and oil construction unverified; route to human reviewer.", "rule_refs": [], "schema_version": "1.0.0"}
